{"algorithm_profile":"exact-layer-name-v1","audit_envelope_sha256":"ff822a98b99b87cbebb2c850da3b887764f30ba3032c863906e6e2964ed1a923","audit_snapshot_sha256":"d34c57108fcedbab45b7ce403120191d9b4e9199bacc53221bb6e9fe1e1bb213","authority":"none","benchmark_manifest_sha256":"ab91a9b8a7a6f0a07a933800e5627c18004c70e3f9aa8c35daf1203c9edb4b1c","canvas":[1280,1280],"character_id":"character-1635e2f149a0cfb6","composite_sha256":"774f6fdae3a49d12054a237408c74f40f05f7d73201fb547efdeaedcc078ff02","coordinate_system":"psd_canvas","dataset_id":"touhou-20-v1","evidence_sha256":"7db33c80daafc69fb08db7fac75fbbb27813548f3e3b17969daded135ae2f3a0","layers":[{"bbox":[352,81,920,773],"canonical_side":"unknown","confidence":null,"image":{"byte_size":346763,"path":"tmp/benchmark-development-audit-2026-09/lingxian/layers/00_back_hair.png","sha256":"161b65f37844124110d87100b7db4a5a535b7a8f95f3d86e1a9476e1cef3c4eb"},"image_sha256":"161b65f37844124110d87100b7db4a5a535b7a8f95f3d86e1a9476e1cef3c4eb","index":0,"layer_id":"layer-000","name":"back hair","observed":{"alpha_nonzero":225152,"empty":false,"visible":true},"raw_name_side":null,"reason_codes":["exact_name_alias"],"review_required":true,"semantic":"hair.back","traversal_index":0},{"bbox":[329,303,588,712],"canonical_side":"unknown","confidence":null,"image":{"byte_size":43274,"path":"tmp/benchmark-development-audit-2026-09/lingxian/layers/01_handwear-r.png","sha256":"67b73578c2d2a0219aacd1ed3e029037f88cdc30492fc46e069144c6c602e56c"},"image_sha256":"67b73578c2d2a0219aacd1ed3e029037f88cdc30492fc46e069144c6c602e56c","index":1,"layer_id":"layer-001","name":"handwear-r","observed":{"alpha_nonzero":22490,"empty":false,"visible":true},"raw_name_side":"r","reason_codes":["ambiguous_layer_name","canonical_side_requires_review"],"review_required":true,"semantic":null,"traversal_index":1},{"bbox":[684,304,944,712],"canonical_side":"unknown","confidence":null,"image":{"byte_size":42269,"path":"tmp/benchmark-development-audit-2026-09/lingxian/layers/02_handwear-l.png","sha256":"790e39a399b04286b9d5d15e9cc5f668102a7a8dc3ff3d3f3dab46fa0b4f9b69"},"image_sha256":"790e39a399b04286b9d5d15e9cc5f668102a7a8dc3ff3d3f3dab46fa0b4f9b69","index":2,"layer_id":"layer-002","name":"handwear-l","observed":{"alpha_nonzero":21912,"empty":false,"visible":true},"raw_name_side":"l","reason_codes":["ambiguous_layer_name","canonical_side_requires_review"],"review_required":true,"semantic":null,"traversal_index":2},{"bbox":[489,624,784,1215],"canonical_side":"unknown","confidence":null,"image":{"byte_size":127776,"path":"tmp/benchmark-development-audit-2026-09/lingxian/layers/03_legwear.png","sha256":"e9b5dd213658b4d0b8d53e4f78d0b62f64b08b6bb69d3ec052d78c0e4ac69f97"},"image_sha256":"e9b5dd213658b4d0b8d53e4f78d0b62f64b08b6bb69d3ec052d78c0e4ac69f97","index":3,"layer_id":"layer-003","name":"legwear","observed":{"alpha_nonzero":108170,"empty":false,"visible":true},"raw_name_side":null,"reason_codes":["ambiguous_layer_name"],"review_required":true,"semantic":null,"traversal_index":3},{"bbox":[609,229,664,316],"canonical_side":"unknown","confidence":null,"image":{"byte_size":5875,"path":"tmp/benchmark-development-audit-2026-09/lingxian/layers/04_neck.png","sha256":"ceeef9975729100ff14e3aea455cf02f7af6b8af90d211c5f94a8087ebc1236d"},"image_sha256":"ceeef9975729100ff14e3aea455cf02f7af6b8af90d211c5f94a8087ebc1236d","index":4,"layer_id":"layer-004","name":"neck","observed":{"alpha_nonzero":4098,"empty":false,"visible":true},"raw_name_side":null,"reason_codes":["exact_name_alias"],"review_required":true,"semantic":"body.neck","traversal_index":4},{"bbox":[462,540,805,711],"canonical_side":"unknown","confidence":null,"image":{"byte_size":54349,"path":"tmp/benchmark-development-audit-2026-09/lingxian/layers/05_bottomwear.png","sha256":"f20694154567817ed0f2eaa7a911561be30d18a7b52fa6e008deb7ae52d6cf1e"},"image_sha256":"f20694154567817ed0f2eaa7a911561be30d18a7b52fa6e008deb7ae52d6cf1e","index":5,"layer_id":"layer-005","name":"bottomwear","observed":{"alpha_nonzero":44238,"empty":false,"visible":true},"raw_name_side":null,"reason_codes":["ambiguous_layer_name"],"review_required":true,"semantic":null,"traversal_index":5},{"bbox":[520,272,748,614],"canonical_side":"unknown","confidence":null,"image":{"byte_size":77065,"path":"tmp/benchmark-development-audit-2026-09/lingxian/layers/06_topwear.png","sha256":"cd8ed9010c419c97c1fb02959bd7cfeead058e951345b912a5e9de76785bb156"},"image_sha256":"cd8ed9010c419c97c1fb02959bd7cfeead058e951345b912a5e9de76785bb156","index":6,"layer_id":"layer-006","name":"topwear","observed":{"alpha_nonzero":50028,"empty":false,"visible":true},"raw_name_side":null,"reason_codes":["exact_name_alias"],"review_required":true,"semantic":"wear.top","traversal_index":6},{"bbox":[586,194,589,198],"canonical_side":"unknown","confidence":null,"image":{"byte_size":120,"path":"tmp/benchmark-development-audit-2026-09/lingxian/layers/07_ears-r.png","sha256":"9ec4b1d9ac986baf350787c09daacc20797d82b19a2b5dbc539826e9f44af8a0"},"image_sha256":"9ec4b1d9ac986baf350787c09daacc20797d82b19a2b5dbc539826e9f44af8a0","index":7,"layer_id":"layer-007","name":"ears-r","observed":{"alpha_nonzero":12,"empty":false,"visible":true},"raw_name_side":"r","reason_codes":["unmapped_layer_name","canonical_side_requires_review"],"review_required":true,"semantic":null,"traversal_index":7},{"bbox":[652,174,695,184],"canonical_side":"unknown","confidence":null,"image":{"byte_size":741,"path":"tmp/benchmark-development-audit-2026-09/lingxian/layers/08_eyebrow-l.png","sha256":"77b2c2c236cfeeeba52406c59d1ccc43ba958c24b9f4235c875f83cc657e0a40"},"image_sha256":"77b2c2c236cfeeeba52406c59d1ccc43ba958c24b9f4235c875f83cc657e0a40","index":8,"layer_id":"layer-008","name":"eyebrow-l","observed":{"alpha_nonzero":201,"empty":false,"visible":true},"raw_name_side":"l","reason_codes":["unmapped_layer_name","canonical_side_requires_review"],"review_required":true,"semantic":null,"traversal_index":8},{"bbox":[573,174,617,185],"canonical_side":"unknown","confidence":null,"image":{"byte_size":763,"path":"tmp/benchmark-development-audit-2026-09/lingxian/layers/09_eyebrow-r.png","sha256":"aae16a89293032f7761ee9f0a085068288542464166c72e83eb8efd676894861"},"image_sha256":"aae16a89293032f7761ee9f0a085068288542464166c72e83eb8efd676894861","index":9,"layer_id":"layer-009","name":"eyebrow-r","observed":{"alpha_nonzero":208,"empty":false,"visible":true},"raw_name_side":"r","reason_codes":["unmapped_layer_name","canonical_side_requires_review"],"review_required":true,"semantic":null,"traversal_index":9},{"bbox":[679,211,701,244],"canonical_side":"unknown","confidence":null,"image":{"byte_size":1796,"path":"tmp/benchmark-development-audit-2026-09/lingxian/layers/10_ears-l.png","sha256":"97d3adbfb7381887a0feafe010e13ec6e18f9f5882b893db73572d2fdfd3e6d5"},"image_sha256":"97d3adbfb7381887a0feafe010e13ec6e18f9f5882b893db73572d2fdfd3e6d5","index":10,"layer_id":"layer-010","name":"ears-l","observed":{"alpha_nonzero":464,"empty":false,"visible":true},"raw_name_side":"l","reason_codes":["unmapped_layer_name","canonical_side_requires_review"],"review_required":true,"semantic":null,"traversal_index":10},{"bbox":[561,100,712,278],"canonical_side":"unknown","confidence":null,"image":{"byte_size":27876,"path":"tmp/benchmark-development-audit-2026-09/lingxian/layers/11_face.png","sha256":"545a5a27cb86ddff235aceabea01e71ba863131ba5a3753e7de3d61a6f814201"},"image_sha256":"545a5a27cb86ddff235aceabea01e71ba863131ba5a3753e7de3d61a6f814201","index":11,"layer_id":"layer-011","name":"face","observed":{"alpha_nonzero":19636,"empty":false,"visible":true},"raw_name_side":null,"reason_codes":["exact_name_alias"],"review_required":true,"semantic":"body.face","traversal_index":11},{"bbox":[633,228,637,236],"canonical_side":"unknown","confidence":null,"image":{"byte_size":187,"path":"tmp/benchmark-development-audit-2026-09/lingxian/layers/12_nose.png","sha256":"fab864b98633ef05dfce78ff7ca81dc02305aafca42e623d156fc65102077085"},"image_sha256":"fab864b98633ef05dfce78ff7ca81dc02305aafca42e623d156fc65102077085","index":12,"layer_id":"layer-012","name":"nose","observed":{"alpha_nonzero":30,"empty":false,"visible":true},"raw_name_side":null,"reason_codes":["unmapped_layer_name"],"review_required":true,"semantic":null,"traversal_index":12},{"bbox":[624,249,647,254],"canonical_side":"unknown","confidence":null,"image":{"byte_size":389,"path":"tmp/benchmark-development-audit-2026-09/lingxian/layers/13_mouth.png","sha256":"a89ecac451eba8c1c57c06be00d4435b4071c1ac708cc5428cc67d1573305dcd"},"image_sha256":"a89ecac451eba8c1c57c06be00d4435b4071c1ac708cc5428cc67d1573305dcd","index":13,"layer_id":"layer-013","name":"mouth","observed":{"alpha_nonzero":82,"empty":false,"visible":true},"raw_name_side":null,"reason_codes":["unmapped_layer_name"],"review_required":true,"semantic":null,"traversal_index":13},{"bbox":[582,196,617,224],"canonical_side":"unknown","confidence":null,"image":{"byte_size":1876,"path":"tmp/benchmark-development-audit-2026-09/lingxian/layers/14_eyewhite-r.png","sha256":"30d9e6dc95e126d5350d15e28176c5b38a418b10476a4ffdf3708ca00ffe8ce0"},"image_sha256":"30d9e6dc95e126d5350d15e28176c5b38a418b10476a4ffdf3708ca00ffe8ce0","index":14,"layer_id":"layer-014","name":"eyewhite-r","observed":{"alpha_nonzero":789,"empty":false,"visible":true},"raw_name_side":"r","reason_codes":["unmapped_layer_name","canonical_side_requires_review"],"review_required":true,"semantic":null,"traversal_index":14},{"bbox":[653,196,687,224],"canonical_side":"unknown","confidence":null,"image":{"byte_size":1827,"path":"tmp/benchmark-development-audit-2026-09/lingxian/layers/15_eyewhite-l.png","sha256":"5a663ecc41f1b4bbf50f92953e795520436cebe4ccf0e4b05c32f8efe38fb570"},"image_sha256":"5a663ecc41f1b4bbf50f92953e795520436cebe4ccf0e4b05c32f8efe38fb570","index":15,"layer_id":"layer-015","name":"eyewhite-l","observed":{"alpha_nonzero":770,"empty":false,"visible":true},"raw_name_side":"l","reason_codes":["unmapped_layer_name","canonical_side_requires_review"],"revie